{
  "$schema": "../schema/site-meta.schema.json",
  "schema_version": 1,
  "generated_at": "2026-10-04",
  "build": {
    "status": "unstamped",
    "commit": null,
    "built_at": null
  },
  "sample_notice": {
    "zh": "本站统计仅代表仓库已结构化并通过当前口径纳入的研究样本，不代表足协、赛事或现实世界官方全量。",
    "en": "Statistics describe only research samples structured under this repository's current rules; they are not official or complete real-world totals."
  },
  "coverage_summary": {
    "dataset_count": 10,
    "record_count": 986,
    "stale_records": 155,
    "needs_review_records": 348
  },
  "freshness": {
    "as_of": "2026-10-04",
    "audited_records": 1290,
    "overdue": 152,
    "by_window": {
      "30": 151,
      "90": 1,
      "180": 0
    }
  },
  "datasets": [
    {
      "id": "players",
      "label": {
        "zh": "球员",
        "en": "Players"
      },
      "record_count": 573,
      "quality": {
        "complete": 70,
        "mixed": 4,
        "partial": 39,
        "needs-review": 312,
        "stale": 148,
        "excluded": 0
      },
      "source_tiers": {
        "1": 546,
        "2": 3,
        "3": 1,
        "4": 0,
        "5": 2,
        "6": 0,
        "unclassified": 21
      },
      "checked_at": {
        "oldest": "2026-05-22",
        "newest": "2026-10-03"
      },
      "overdue_records": 148,
      "missing_fields": [
        {
          "field": "names.native_verified",
          "count": 229
        },
        {
          "field": "source_layers",
          "count": 60
        }
      ]
    },
    {
      "id": "tournaments",
      "label": {
        "zh": "当前赛事",
        "en": "Current tournaments"
      },
      "record_count": 26,
      "quality": {
        "complete": 15,
        "mixed": 0,
        "partial": 11,
        "needs-review": 0,
        "stale": 0,
        "excluded": 0
      },
      "source_tiers": {
        "1": 15,
        "2": 0,
        "3": 0,
        "4": 0,
        "5": 1,
        "6": 0,
        "unclassified": 10
      },
      "checked_at": {
        "oldest": "2026-05-22",
        "newest": "2026-10-04"
      },
      "overdue_records": 0,
      "missing_fields": []
    },
    {
      "id": "tournament_archive",
      "label": {
        "zh": "赛事档案",
        "en": "Tournament archive"
      },
      "record_count": 75,
      "quality": {
        "complete": 0,
        "mixed": 0,
        "partial": 75,
        "needs-review": 0,
        "stale": 0,
        "excluded": 0
      },
      "source_tiers": {
        "1": 0,
        "2": 0,
        "3": 0,
        "4": 0,
        "5": 57,
        "6": 0,
        "unclassified": 18
      },
      "checked_at": {
        "oldest": "2026-06-28",
        "newest": "2026-10-04"
      },
      "overdue_records": 0,
      "missing_fields": [
        {
          "field": "final_draw",
          "count": 24
        },
        {
          "field": "source_version",
          "count": 18
        },
        {
          "field": "source_checked_at",
          "count": 13
        }
      ]
    },
    {
      "id": "projects",
      "label": {
        "zh": "青训项目",
        "en": "Youth programmes"
      },
      "record_count": 44,
      "quality": {
        "complete": 35,
        "mixed": 0,
        "partial": 9,
        "needs-review": 0,
        "stale": 0,
        "excluded": 0
      },
      "source_tiers": {
        "1": 35,
        "2": 0,
        "3": 0,
        "4": 0,
        "5": 0,
        "6": 0,
        "unclassified": 9
      },
      "checked_at": {
        "oldest": "2026-07-20",
        "newest": "2026-08-02"
      },
      "overdue_records": 0,
      "missing_fields": [
        {
          "field": "dossier",
          "count": 1
        },
        {
          "field": "last_checked",
          "count": 1
        },
        {
          "field": "source_links",
          "count": 1
        }
      ]
    },
    {
      "id": "dossiers",
      "label": {
        "zh": "专题档案",
        "en": "Research dossiers"
      },
      "record_count": 9,
      "quality": {
        "complete": 0,
        "mixed": 0,
        "partial": 9,
        "needs-review": 0,
        "stale": 0,
        "excluded": 0
      },
      "source_tiers": {
        "1": 0,
        "2": 0,
        "3": 0,
        "4": 0,
        "5": 0,
        "6": 0,
        "unclassified": 9
      },
      "checked_at": {
        "oldest": "2026-05-23",
        "newest": "2026-08-02"
      },
      "overdue_records": 0,
      "missing_fields": []
    },
    {
      "id": "scouting_watchlist",
      "label": {
        "zh": "球探观察池",
        "en": "Scouting watchlist"
      },
      "record_count": 34,
      "quality": {
        "complete": 0,
        "mixed": 0,
        "partial": 0,
        "needs-review": 34,
        "stale": 0,
        "excluded": 0
      },
      "source_tiers": {
        "1": 0,
        "2": 0,
        "3": 0,
        "4": 0,
        "5": 0,
        "6": 0,
        "unclassified": 34
      },
      "checked_at": {
        "oldest": "2026-07-19",
        "newest": "2026-08-19"
      },
      "overdue_records": 0,
      "missing_fields": [
        {
          "field": "named_afc_player",
          "count": 4
        }
      ]
    },
    {
      "id": "youth_systems",
      "label": {
        "zh": "国家青训节点",
        "en": "National pathway nodes"
      },
      "record_count": 35,
      "quality": {
        "complete": 35,
        "mixed": 0,
        "partial": 0,
        "needs-review": 0,
        "stale": 0,
        "excluded": 0
      },
      "source_tiers": {
        "1": 35,
        "2": 0,
        "3": 0,
        "4": 0,
        "5": 0,
        "6": 0,
        "unclassified": 0
      },
      "checked_at": {
        "oldest": "2026-08-02",
        "newest": "2026-08-02"
      },
      "overdue_records": 0,
      "missing_fields": []
    },
    {
      "id": "coaches",
      "label": {
        "zh": "教练",
        "en": "Coaches"
      },
      "record_count": 42,
      "quality": {
        "complete": 15,
        "mixed": 0,
        "partial": 18,
        "needs-review": 2,
        "stale": 7,
        "excluded": 0
      },
      "source_tiers": {
        "1": 16,
        "2": 2,
        "3": 0,
        "4": 2,
        "5": 6,
        "6": 0,
        "unclassified": 16
      },
      "checked_at": {
        "oldest": "2026-06-27",
        "newest": "2026-10-04"
      },
      "overdue_records": 7,
      "missing_fields": [
        {
          "field": "record",
          "count": 4
        }
      ]
    },
    {
      "id": "overseas_history",
      "label": {
        "zh": "留洋历史",
        "en": "Overseas history"
      },
      "record_count": 138,
      "quality": {
        "complete": 1,
        "mixed": 0,
        "partial": 137,
        "needs-review": 0,
        "stale": 0,
        "excluded": 0
      },
      "source_tiers": {
        "1": 0,
        "2": 1,
        "3": 0,
        "4": 0,
        "5": 15,
        "6": 0,
        "unclassified": 122
      },
      "checked_at": {
        "oldest": "2026-07-20",
        "newest": "2026-07-20"
      },
      "overdue_records": 0,
      "missing_fields": [
        {
          "field": "source_links",
          "count": 98
        }
      ]
    },
    {
      "id": "uefa_youth_league",
      "label": {
        "zh": "欧洲青年联赛赛季",
        "en": "UEFA Youth League seasons"
      },
      "record_count": 10,
      "quality": {
        "complete": 0,
        "mixed": 0,
        "partial": 10,
        "needs-review": 0,
        "stale": 0,
        "excluded": 0
      },
      "source_tiers": {
        "1": 0,
        "2": 0,
        "3": 0,
        "4": 0,
        "5": 0,
        "6": 0,
        "unclassified": 10
      },
      "checked_at": {
        "oldest": "2026-07-18",
        "newest": "2026-07-18"
      },
      "overdue_records": 0,
      "missing_fields": [
        {
          "field": "source_links",
          "count": 10
        }
      ]
    }
  ],
  "schemas": [
    {
      "path": "data/raw/players/*.json",
      "schema": "https://football-research.local/schema/players.schema.json"
    },
    {
      "path": "data/raw/tournaments.json",
      "schema": "https://football-research.local/schema/datasets.schema.json#/$defs/tournaments"
    },
    {
      "path": "data/raw/projects.json",
      "schema": "https://football-research.local/schema/datasets.schema.json#/$defs/projects"
    },
    {
      "path": "data/raw/dossiers.json",
      "schema": "https://football-research.local/schema/datasets.schema.json#/$defs/dossiers"
    },
    {
      "path": "data/raw/scouting-watchlist.json",
      "schema": "https://football-research.local/schema/datasets.schema.json#/$defs/scoutingWatchlist"
    },
    {
      "path": "data/raw/tournament-archive.json",
      "schema": "https://football-research.local/schema/datasets.schema.json#/$defs/tournamentArchive"
    },
    {
      "path": "data/raw/overseas-history.json",
      "schema": "https://football-research.local/schema/datasets.schema.json#/$defs/overseasHistory"
    },
    {
      "path": "data/raw/uefa-youth-league.json",
      "schema": "https://football-research.local/schema/datasets.schema.json#/$defs/uefaYouthLeague"
    },
    {
      "path": "data/raw/china-men-youth-coaches.json",
      "schema": "https://football-research.local/schema/datasets.schema.json#/$defs/chinaNationalYouthCoaches"
    },
    {
      "path": "data/raw/china-youth-development-coaches.json",
      "schema": "https://football-research.local/schema/datasets.schema.json#/$defs/coachCollection"
    },
    {
      "path": "data/raw/football-stories.json",
      "schema": "https://football-research.local/schema/datasets.schema.json#/$defs/footballStories"
    },
    {
      "path": "data/raw/youth-training-disputes.json",
      "schema": "https://football-research.local/schema/datasets.schema.json#/$defs/youthTrainingDisputes"
    },
    {
      "path": "data/raw/big-five-asian-coaches.json",